Question,Answer
vậy tại sao mọi người đều khóa cửa?,thị trưởng nói rằng tỷ lệ tội phạm đang giảm.
tôi đoán họ chưa đọc bài viết này.,vậy tại sao mọi người đều khóa cửa?
không ai tin rằng tỷ lệ tội phạm đang giảm xuống.,tôi đoán họ chưa đọc bài viết này.
có lẽ thị trưởng chỉ đang nói về khu phố của ông ấy thôi.,không ai tin rằng tỷ lệ tội phạm đang giảm xuống.
tại sao vậy?,những người sống ở California thật điên rồ.
vì tất cả các trận động đất và hỏa hoạn.,tại sao vậy?
nhưng những trận động đất lớn chỉ thỉnh thoảng xảy ra.,vì tất cả các trận động đất và hỏa hoạn.
thỉnh thoảng có một lần là quá nhiều.,nhưng những trận động đất lớn chỉ thỉnh thoảng xảy ra.
nhưng bạn nói đúng. có rất nhiều đám cháy.,thỉnh thoảng có một lần là quá nhiều.
một trận hỏa hoạn gần đây đã phá hủy 85 ngôi nhà.,nhưng bạn nói đúng. có rất nhiều đám cháy.
bạn có thích nó không?,tôi đã đến Hawaii vào kỳ nghỉ.
tôi yêu nó. tôi muốn sống ở đó,bạn có thích nó không?
bạn thích cái gì?,tôi yêu nó. tôi muốn sống ở đó
tôi đã đi đến bãi biển mỗi ngày,bạn đã đi bơi chưa?
thời tiết thế nào?,tôi đã đi đến bãi biển mỗi ngày
trời nóng và nắng mỗi ngày.,thời tiết thế nào?
bạn đã làm gì vào ban đêm?,trời nóng và nắng mỗi ngày.
buổi tối tôi ra ngoài ăn. thức ăn rất ngon.,bạn đã làm gì vào ban đêm?
những người sống ở Hawaii thật may mắn.,buổi tối tôi ra ngoài ăn. thức ăn rất ngon.
bạn thích gì về nó?,tôi thích khách sạn này
chúng tôi nhận được một bữa ăn sáng miễn phí.,bạn thích gì về nó?
cà phê và một ổ bánh mì?,chúng tôi nhận được một bữa ăn sáng miễn phí.
có chuyện gì thế? đây là một căn phòng đẹp,tối nay tôi không ngủ ở đây
nhìn vào tờ này.,có chuyện gì với cái giường vậy?
Đúng?,nhìn vào tờ này.
nhìn thấy những vết bẩn đó?,Đúng?
tôi chắc chắn vậy.,nhìn thấy những vết bẩn đó?
tôi không ngủ trên tấm ga đó.,tôi chắc chắn vậy.
nó rời đi lúc 12:15.,máy bay của bạn cất cánh lúc mấy giờ?
khi nào bạn phải có mặt ở sân bay?,nó rời đi lúc 12:15.
tôi phải đến đó sớm hai tiếng.,khi nào bạn phải có mặt ở sân bay?
nên chúng ta phải có mặt ở sân bay lúc 10:15.,tôi phải đến đó sớm hai tiếng.
điều đó có nghĩa là chúng ta phải rời khỏi nhà lúc 9:15.,nên chúng ta phải có mặt ở sân bay lúc 10:15.
bạn không bao giờ biết điều gì có thể xảy ra trên những xa lộ này.,tôi đồng ý.
có ít nhất một vụ tai nạn lớn mỗi ngày.,bạn không bao giờ biết điều gì có thể xảy ra trên những xa lộ này.
khi nào bạn đi?,tôi cần bay tới New York.
trong kỳ nghỉ lễ Giáng sinh.,khi nào bạn đi?
tốt nhất bạn nên mua vé ngay bây giờ.,trong kỳ nghỉ lễ Giáng sinh.
chắc bạn đang đùa.,tốt nhất bạn nên mua vé ngay bây giờ.
tôi cá đây là lần đầu tiên bạn bay vào dịp Giáng sinh.,tôi nghĩ tôi sẽ đợi đến tháng 10.
bạn nói đúng.,tôi cá đây là lần đầu tiên bạn bay vào dịp Giáng sinh.
giá rẻ hơn sẽ không giúp ích gì cho bạn nếu không có chỗ ngồi.,nhưng có thể giá sẽ rẻ hơn vào tháng 10.
tôi cũng vậy.,tôi ghét bay.
bạn đang bị kẹt giữa những người xung quanh bạn.,bây giờ nó giống như đi xe buýt.
mọi người luôn thức dậy để sử dụng phòng tắm.,bạn không có chỗ cho khuỷu tay hay đầu gối.
bọn trẻ đang khóc hoặc trèo lên người bạn.,mọi người luôn thức dậy để sử dụng phòng tắm.
đó là một vườn thú bay!,bọn trẻ đang khóc hoặc trèo lên người bạn.
tôi ước tôi có thể mua được chỗ ngồi hạng nhất.,đó là một vườn thú bay!
phải không mọi người?,tôi ước tôi có thể mua được chỗ ngồi hạng nhất.
tốt cho anh ấy.,một anh chàng nào đó đã chèo thuyền vượt Đại Tây Dương.
tại sao anh ấy lại làm vậy?,tốt cho anh ấy.
anh ấy đã lập kỷ lục mới à?,tại sao anh ấy lại làm vậy?
bây giờ anh ấy đã có kỷ lục thế giới!,vấn đề là gì?
một số người làm điều đó chỉ để làm điều đó.,tôi không nghĩ anh ấy thậm chí còn được trả tiền cho việc đó.
điều đó nghe có vẻ vui. bạn muốn đi đâu?,tôi muốn đi trên một con tàu du lịch.
tôi muốn đi du lịch đến hawaii.,điều đó nghe có vẻ vui. bạn muốn đi đâu?
tôi nghĩ nó phụ thuộc vào mùa và cabin của bạn.,tôi không biết nó sẽ có giá bao nhiêu
bạn định đi du lịch một mình à?,và tôi muốn có một cabin lớn với tầm nhìn.
vì tất cả sự an toàn?,tôi ghét phải bay.
bạn có định đi đâu không?,Kỳ nghỉ xuân bắt đầu vào ngày mai.
tôi đang nghĩ đến việc lái xe tới Arizona.,bạn có định đi đâu không?
đến hẻm núi lớn?,tôi đang nghĩ đến việc lái xe tới Arizona.
Đúng. tôi chưa bao giờ đến đó,đến hẻm núi lớn?
tôi đã ở đó khi tôi còn nhỏ,Đúng. tôi chưa bao giờ đến đó
bạn thích nó như thế nào?,tôi đã ở đó khi tôi còn nhỏ
tôi yêu nó. tôi vẫn nhớ nó tuyệt vời thế nào.,bạn thích nó như thế nào?
không đời nào! tôi không muốn rơi vào cái chết của tôi.,bạn nên thử cưỡi la trên con đường mòn dẫn xuống phía dưới.
Đừng lo. chỉ có một người từng bị ngã khỏi con la.,không đời nào! tôi không muốn rơi vào cái chết của tôi.
tồi tệ nhất trên toàn thế giới.,khách sạn đó thật tồi tệ.
những bức tường rất mỏng.,tồi tệ nhất trên toàn thế giới.
suốt ngày chúng tôi nghe thấy tiếng tivi hoặc điện thoại.,những bức tường rất mỏng.
suốt đêm chúng tôi nghe thấy mọi người ngáy.,suốt ngày chúng tôi nghe thấy tiếng tivi hoặc điện thoại.
công việc dọn phòng không cho chúng tôi khăn tắm mới.,suốt đêm chúng tôi nghe thấy mọi người ngáy.
dịch vụ phòng mang đến cho chúng tôi một bữa tối nguội.,công việc dọn phòng không cho chúng tôi khăn tắm mới.
phòng không hút thuốc của chúng tôi đầy khói thuốc lá.,dịch vụ phòng mang đến cho chúng tôi một bữa tối nguội.
phòng của chúng tôi ở ngay cạnh thang máy và máy làm đá.,phòng không hút thuốc của chúng tôi đầy khói thuốc lá.
họ đã thêm các khoản phí giả mạo vào hóa đơn của chúng tôi.,phòng của chúng tôi ở ngay cạnh thang máy và máy làm đá.
làm thế nào mà chúng ta lại ở trong khách sạn khủng khiếp đó?,họ đã thêm các khoản phí giả mạo vào hóa đơn của chúng tôi.
đại lý du lịch đã giảm giá 50% cho chúng tôi!,làm thế nào mà chúng ta lại ở trong khách sạn khủng khiếp đó?
thậm chí còn chưa đến 10 giờ.,tôi phải cúp máy. tôi buồn ngủ quá
tôi đang ngủ quên trên điện thoại.,thậm chí còn chưa đến 10 giờ.
bạn dậy sớm thật đấy,tôi đang ngủ quên trên điện thoại.
tôi phải đưa bạn tôi đến sân bay.,bạn dậy sớm thật đấy
tại sao bạn không chợp mắt khi về đến nhà?,tôi phải đưa bạn tôi đến sân bay.
tôi đã không về nhà cho đến 30 phút trước.,tại sao bạn không chợp mắt khi về đến nhà?
tại sao vậy?,tôi đã không về nhà cho đến 30 phút trước.
có một lời đe dọa đánh bom ở sân bay.,tại sao vậy?
chỉ là lời đe dọa?,có một lời đe dọa đánh bom ở sân bay.
tổ chức tư nhân nào đó.,ai đã mời họ?
tại sao họ lại mời anh ấy?,tổ chức tư nhân nào đó.
để cảm ơn anh ấy và tất cả những người lính khác đã phục vụ trong Thế chiến thứ hai.,tại sao họ lại mời anh ấy?
điều đó rất hay.,để cảm ơn anh ấy và tất cả những người lính khác đã phục vụ trong Thế chiến thứ hai.
bố tôi đã được nhìn thấy tượng đài chiến tranh thế giới thứ hai mới tuyệt đẹp.,điều đó rất hay.
chuyến đi đó chắc phải tốn rất nhiều tiền.,bố tôi đã được nhìn thấy tượng đài chiến tranh thế giới thứ hai mới tuyệt đẹp.
ông cho biết tất cả số tiền đều đến từ sự đóng góp của tư nhân.,chuyến đi đó chắc phải tốn rất nhiều tiền.
chuyến bay kéo dài bao lâu?,khoảng 90 cựu chiến binh Thế chiến thứ hai chúng tôi lên máy bay lúc 8 giờ sáng.
chỉ mất khoảng hai giờ.,chuyến bay kéo dài bao lâu?
bạn có chụp ảnh ở đài tưởng niệm chiến tranh thế giới thứ hai không?,chỉ mất khoảng hai giờ.
tôi tưởng bạn đã có việc làm.,tôi cần một công việc.
tôi đã làm vậy.,tôi tưởng bạn đã có việc làm.
chuyện gì đã xảy ra thế?,tôi đã làm vậy.
tôi đã bị sa thải.,chuyện gì đã xảy ra thế?
điều đó thật khủng khiếp! nó đã xảy ra khi nào?,tôi đã bị sa thải.
tôi đã bị sa thải vào tuần trước,điều đó thật khủng khiếp! nó đã xảy ra khi nào?
chỉ bạn thôi à?,tôi đã bị sa thải vào tuần trước
tôi đang tìm việc trên báo.,bạn định làm gì?
chúc may mắn!,tôi đang tìm việc trên báo.
Móng tay của bạn có sạch không?,kiểm tra cái gì?
giày của tôi sáng bóng.,bạn đã đánh bóng đôi giày của bạn chưa?
tất của bạn có phù hợp không?,giày của tôi sáng bóng.
tất nhiên là chúng phù hợp.,tất của bạn có phù hợp không?
chắc chắn là vậy.,cuộc sống thật khó khăn.
tôi nghĩ trường học thật khó khăn,chắc chắn là vậy.
đôi khi tôi ước mình được trở lại trường học,tôi đồng ý. đi làm cũng vất vả như đi học.
nó trôi qua khá nhanh.,và chỉ mới 12 năm thôi.
nhưng công việc vẫn tiếp diễn mãi mãi!,nó trôi qua khá nhanh.
chúng ta phải làm việc trong 30 năm!,nhưng công việc vẫn tiếp diễn mãi mãi!
tôi cũng vậy.,tôi buồn ngủ.
tôi đã có một ngày dài,tôi cũng vậy.
tôi cũng vậy.,tôi đã có một ngày dài
tôi thậm chí còn không ăn trưa.,tôi cũng vậy.
tôi cũng vậy.,tôi thậm chí còn không ăn trưa.
tôi bận cả ngày.,tôi cũng vậy.
tôi cũng vậy.,tôi bận cả ngày.
tôi phải mang công việc về nhà.,tôi cũng vậy.
tôi cũng vậy.,tôi phải mang công việc về nhà.
ngày của bạn cũng giống như của tôi.,tôi cũng vậy.
tất nhiên là như vậy. chúng ta làm việc cùng nhau!,ngày của bạn cũng giống như của tôi.
bạn làm nghề gì?,tôi không thích công việc của tôi
tôi là người giữ trẻ.,bạn làm nghề gì?
công việc đó có nhiều không?,tôi là người giữ trẻ.
bé khóc suốt.,công việc đó có nhiều không?
bạn phải thay tã cho chúng.,bé khóc suốt.
tôi phải cho chúng ăn.,bạn phải thay tã cho chúng.
bạn đang tìm kiếm một công việc khác?,tôi phải cho chúng ăn.
một gia đình chỉ có một đứa con.,một gia đình khác?
đó là một ý tưởng tốt,một gia đình chỉ có một đứa con.
công việc cuối cùng của bạn là gì?,tôi cần một công việc.
tôi là một họa sĩ.,công việc cuối cùng của bạn là gì?
chuyện gì đã xảy ra thế?,tôi là một họa sĩ.
tôi bị sa thải vì không có việc làm,chuyện gì đã xảy ra thế?
bạn có thể làm gì khác?,tôi bị sa thải vì không có việc làm
tôi là một người siêng năng.,bạn có thể làm gì khác?
bạn có thể sửa vòi nước nhỏ giọt trong bồn rửa nhà bếp không?,tôi là một người siêng năng.
tất nhiên rồi.,bạn có thể sửa vòi nước nhỏ giọt trong bồn rửa nhà bếp không?
thì tôi có việc cho bạn trong nhà bếp của tôi.,tất nhiên rồi.
bạn sẽ chỉ tốn 20 USD cộng thêm các bộ phận.,thì tôi có việc cho bạn trong nhà bếp của tôi.
được rồi. nghe có vẻ là giá hợp lý.,bạn sẽ chỉ tốn 20 USD cộng thêm các bộ phận.
tôi không biết. tôi đã ở đây được 20 năm.,bạn sẽ làm gì nếu bị mất việc?
bạn có kỹ năng nào khác không?,tôi không biết. tôi đã ở đây được 20 năm.
bạn có nghe thấy điều gì đó mà bạn không nói với tôi không?,sẽ không có ai thuê bạn lật bánh mì kẹp thịt.
Ý anh là gì?,bạn có nghe thấy điều gì đó mà bạn không nói với tôi không?
sắp có đợt sa thải ở nơi này phải không?,Ý anh là gì?
tôi chắc chắn hy vọng là không!,sắp có đợt sa thải ở nơi này phải không?
giảng dạy là một công việc tuyệt vời.,tôi bảo học sinh của tôi hãy trở thành giáo viên.
đó là công việc tốt nhất mà tôi từng có.,giảng dạy là một công việc tuyệt vời.
điều gì làm cho nó tốt như vậy?,đó là công việc tốt nhất mà tôi từng có.
ý tôi là tôi có những học sinh tuyệt vời.,Ý anh là gì?
điều đó hẳn là tốt đẹp.,ý tôi là tôi có những học sinh tuyệt vời.
giảng dạy là phần tuyệt vời nhất trong cả ngày của tôi.,điều đó hẳn là tốt đẹp.
bạn là một người đàn ông may mắn khi có được công việc bạn yêu thích.,giảng dạy là phần tuyệt vời nhất trong cả ngày của tôi.
điều gì khiến anh ấy tệ đến vậy?,tôi nghĩ tôi có ông chủ tồi tệ nhất trên thế giới.
anh ấy thô lỗ và la hét rất nhiều.,điều gì khiến anh ấy tệ đến vậy?
điều đó thật khó chấp nhận,anh ấy thô lỗ và la hét rất nhiều.
tôi chưa bao giờ nghe anh ấy nói làm ơn hay cảm ơn.,điều đó thật khó chấp nhận
anh ta có vẻ giống như một kẻ ngốc thực sự.,tôi chưa bao giờ nghe anh ấy nói làm ơn hay cảm ơn.
không ai ở nơi làm việc thích anh ấy.,anh ta có vẻ giống như một kẻ ngốc thực sự.
bạn không thể báo cáo anh ta với người giám sát của mình?,không ai ở nơi làm việc thích anh ấy.
về cái gì?,chúng ta sẽ làm gì?
về việc tìm việc làm cho tôi.,về cái gì?
bạn không cần một công việc. tôi kiếm đủ tiền cho cả hai chúng ta.,về việc tìm việc làm cho tôi.
điều đó không quan trọng tôi không muốn ngồi xung quanh,bạn không cần một công việc. tôi kiếm đủ tiền cho cả hai chúng ta.
nhưng bạn ghét thuốc lá và bạn ghét hút thuốc!,bật lửa thuốc lá. tôi sẽ kiếm được nhiều tiền.
tất nhiên rồi. bạn bè để làm gì?,bạn cũng sẽ làm điều tương tự với tôi
bạn đã làm gì thế?,tôi nghĩ tôi đã làm điều gì đó thực sự ngu ngốc.
tôi đã mua một số cổ phiếu,bạn đã làm gì thế?
mọi người đều mua cổ phiếu,tôi đã mua một số cổ phiếu
tôi đã mua nó theo linh cảm.,mọi người đều mua cổ phiếu
bạn chưa đọc về công ty trước à?,tôi đã mua nó theo linh cảm.
tôi đã không phải làm vậy nó đã hoạt động được 60 năm.,bạn chưa đọc về công ty trước à?
vậy vấn đề là gì?,tôi đã không phải làm vậy nó đã hoạt động được 60 năm.
tôi đã sử dụng tất cả tiền tiết kiệm của mình vào công ty này.,vậy vấn đề là gì?
bạn bỏ tất cả trứng vào một giỏ.,tôi đã sử dụng tất cả tiền tiết kiệm của mình vào công ty này.
chuyện gì đã xảy ra với kế hoạch của bạn?,tôi sắp trở thành bác sĩ
tôi có bằng tốt nghiệp đại học môn hóa học.,chuyện gì đã xảy ra với kế hoạch của bạn?
tại sao vậy?,và bây giờ tôi mừng vì tôi đã không làm thế.
bệnh viện là nơi nguy hiểm nhất thế giới,tại sao vậy?
Tại sao?,tôi muốn trở thành người đưa thư khi lớn lên.
vì bạn sẽ gặp được rất nhiều người.,Tại sao?
bạn chắc chắn làm được.,vì bạn sẽ gặp được rất nhiều người.
và bạn tập thể dục rất nhiều mỗi ngày.,bạn chắc chắn làm được.
đó là sự thật,và bạn tập thể dục rất nhiều mỗi ngày.
và bạn có thể chơi với rất nhiều con chó.,đó là sự thật
tới tiểu bang hay thành phố?,tôi muốn chuyển đến New York.
vì tôi muốn kiếm thật nhiều tiền.,tại sao bạn muốn chuyển đến đó?
có rất nhiều người nghèo ở New York.,vì tôi muốn kiếm thật nhiều tiền.
chắc chắn là có—ít nhất là một triệu.,có rất nhiều người nghèo ở New York.
vậy bạn dự định trở nên giàu có như thế nào?,chắc chắn là có—ít nhất là một triệu.
tôi sẽ gõ cửa tất cả các tập đoàn.,vậy bạn dự định trở nên giàu có như thế nào?
điều đó sẽ không làm cho bạn giàu có. sẽ không có ai nói chuyện với bạn,tôi sẽ gõ cửa tất cả các tập đoàn.
tôi sẽ tiếp tục gõ cửa.,điều đó sẽ không làm cho bạn giàu có. sẽ không có ai nói chuyện với bạn
tất cả những gì bạn sẽ nhận được là các đốt ngón tay bị đau.,tôi sẽ tiếp tục gõ cửa.
Tôi cũng vậy.,tôi yêu món salad.
tôi thường ăn một món salad đơn giản.,Tôi cũng vậy.
bạn cho gì vào đó?,tôi thường ăn một món salad đơn giản.
tôi thêm một ít hạt tiêu và muối.,thế thôi à?
tôi luôn cho phô mai vào món salad của mình.,tôi thêm một ít hạt tiêu và muối.
tôi đổ rất nhiều nước sốt kiểu Pháp lên trên.,bạn sử dụng loại trang phục nào?
Tôi cũng vậy. Nước sốt kiểu Pháp ngon quá! ai quan tâm đến lượng calo?,tôi đổ rất nhiều nước sốt kiểu Pháp lên trên.
Tôi cũng vậy.,tôi yêu phô mai.
phô mai đến từ đâu?,Tôi cũng vậy.
nó đến từ những con bò.,phô mai đến từ đâu?
chúng tôi nhận được bánh mì kẹp thịt và bít tết.,chúng ta còn nhận được gì nữa từ những con bò?
bạn thích nó như thế nào?,tôi đã từng làm việc ở một cửa hàng bán đồ ăn nhanh
tôi yêu nó!,bạn thích nó như thế nào?
bạn có nhận được đồ ăn miễn phí không?,tôi yêu nó!
tôi ăn phô mai và thịt miễn phí mỗi ngày.,bạn có nhận được đồ ăn miễn phí không?
Nghe có vẻ là một công việc tuyệt vời.,tôi ăn phô mai và thịt miễn phí mỗi ngày.
bây giờ bạn đang ăn gì?,tôi đang thực hiện một chế độ ăn kiêng mới.
tôi đã chuyển từ mì ống sang khoai tây.,bây giờ bạn đang ăn gì?
tại sao bạn làm điều đó?,tôi đã chuyển từ mì ống sang khoai tây.
mì ống là thực phẩm chế biến. khoai tây là thực phẩm tự nhiên.,tại sao bạn làm điều đó?
thực phẩm tự nhiên có nhiều vitamin hơn.,mì ống là thực phẩm chế biến. khoai tây là thực phẩm tự nhiên.
và nó thật dễ dàng để chuẩn bị.,thực phẩm tự nhiên có nhiều vitamin hơn.
bạn chuẩn bị khoai tây như thế nào?,và nó thật dễ dàng để chuẩn bị.
tại sao vậy?,mẹ của bạn gái tôi đã giận tôi ở bàn ăn tối.
tôi rắc muối và hạt tiêu lên thức ăn trước khi nếm thử.,tại sao vậy?
có chuyện gì vậy?,tôi rắc muối và hạt tiêu lên thức ăn trước khi nếm thử.
mẹ cô ấy là một đầu bếp tuyệt vời,có chuyện gì vậy?
Ồ.,nó làm tổn thương cảm xúc của cô ấy.
tôi chắc chắn mọi thứ sẽ ổn trong một hoặc hai ngày.,có lẽ bạn không nên ăn ở đó nữa.
đó là lỗi của bạn gái bạn. lẽ ra cô ấy nên cảnh báo bạn.,tôi chắc chắn mọi thứ sẽ ổn trong một hoặc hai ngày.
bạn đang đùa đấy,tôi ăn cùng một thứ mỗi ngày
có chuyện gì thế?,có gì đó không ổn với quả cam của tôi.
nó không phải màu cam!,có chuyện gì thế?
quả cam của bạn không phải là màu cam?,nó không phải màu cam!
ai biết? có lẽ chúng ta sẽ sớm có chuối hồng.,thế giới này đang đến với điều gì?
luộc? tôi chưa bao giờ nghe nói về điều đó,tôi thích đậu phộng luộc.
chỉ cần luộc đậu phộng sống trong nước muối cho đến khi vỏ mềm.,luộc? tôi chưa bao giờ nghe nói về điều đó
lúc nào đó tôi sẽ phải thử chúng.,chỉ cần luộc đậu phộng sống trong nước muối cho đến khi vỏ mềm.
chúng ngon nhất khi còn nóng.,lúc nào đó tôi sẽ phải thử chúng.
anh trai tôi bị dị ứng với đậu phộng.,chúng ngon nhất khi còn nóng.
điều đó không tốt.,anh trai tôi bị dị ứng với đậu phộng.
anh ấy có một chế độ ăn kiêng rất nghiêm ngặt,tôi đoán anh ấy phải rất cẩn thận về những gì anh ấy ăn.
bạn đã đạt được bao nhiêu?,tôi đang tăng cân.
ba bảng chỉ trong tháng này.,bạn đã đạt được bao nhiêu?
bạn có biết tại sao không?,ba bảng chỉ trong tháng này.
tôi nghĩ đó là kem.,bạn có biết tại sao không?
bạn bắt đầu ăn kem à?,tôi nghĩ đó là kem.
nó đã được bán.,bạn bắt đầu ăn kem à?
bạn đã mua bao nhiêu?,nó đã được bán.
tôi đã lấp đầy tủ lạnh của mình bằng kem.,bạn đã mua bao nhiêu?
tất nhiên rồi. bạn đã ăn mọi thứ trên bàn,tôi no rồi.
tôi không thích ăn thức ăn thừa,tất nhiên rồi. bạn đã ăn mọi thứ trên bàn
tôi rất vui khi biết có thứ gì đó bạn không thích ăn.,tôi không thích ăn thức ăn thừa
tôi thích thức ăn của tôi nóng và tươi.,tôi rất vui khi biết có thứ gì đó bạn không thích ăn.
bạn muốn thấy nó biến mất.,tôi thích thức ăn của tôi nóng và tươi.
tôi không thích nó được hâm nóng lại,bạn muốn thấy nó biến mất.
Tôi đã nới lỏng thắt lưng và cởi cúc quần.,bạn nên nới lỏng thắt lưng của bạn.
tôi không làm gì cả,tôi đã thấy những gì bạn đã làm
bạn biết tôi đang nói về điều gì,bạn đang nói về cái gì vậy?
tôi không có ý kiến ​​gì,bạn biết tôi đang nói về điều gì
bạn biết bạn đã làm gì.,tôi không có ý kiến ​​gì
tôi hứa tôi sẽ không bao giờ uống rượu trong hộp nữa.,không uống sữa trong hộp. dùng kính!
tôi cũng vậy.,tôi thích cái áo sơ mi đó
nó bao nhiêu?,tôi cũng vậy.
Tôi không biết. thẻ bị thiếu.,nó bao nhiêu?
hỏi nhân viên bán hàng.,Tôi không biết. thẻ bị thiếu.
Tôi sẽ.,hỏi nhân viên bán hàng.
tôi nghĩ tôi sẽ mua cả hai.,đó là một mức giá tuyệt vời
tốt nhất bạn nên thử chúng trước.,tôi nghĩ tôi sẽ mua cả hai.
Cảm ơn.,tôi đã mua cho bạn một chiếc quần
tôi hy vọng chúng phù hợp,Cảm ơn.
tôi hy vọng bạn giữ biên nhận.,tôi hy vọng chúng phù hợp
bạn nghĩ chúng sẽ không vừa?,tôi hy vọng bạn giữ biên nhận.
tôi nghĩ tôi đã tăng cân.,bạn nghĩ chúng sẽ không vừa?
bạn nghĩ sao?,tôi nghĩ tôi đã tăng cân.
có thể là một hoặc hai pound.,bạn nghĩ sao?
có lẽ bốn hoặc năm pound?,có thể là một hoặc hai pound.
vòng eo của tôi đã lớn hơn nó.,có lẽ bốn hoặc năm pound?
Không vấn đề. những chiếc quần này có dây thắt lưng co giãn.,vòng eo của tôi đã lớn hơn nó.
bạn thật thông minh!,Không vấn đề. những chiếc quần này có dây thắt lưng co giãn.
hãy để tôi nhìn vào danh sách của chúng tôi,chúng ta cần mua gì?
tôi biết chúng ta cần sữa.,hãy để tôi nhìn vào danh sách của chúng tôi
không béo.,tôi biết chúng ta cần sữa.
tất nhiên rồi. còn gì nữa?,không béo.
Thụy Sĩ.,loại phô mai nào?
tại sao không?,tôi chưa bao giờ mua phô mai Thụy Sĩ.
tôi không muốn trả tiền cho những cái lỗ.,tại sao không?
tôi tưởng bạn vừa mua một đôi.,tôi cần một số quần.
tôi đã làm vậy.,tôi tưởng bạn vừa mua một đôi.
chuyện gì xảy ra với họ sớm vậy?,tôi đã làm vậy.
