Question,Answer
để thử một cái gì đó mới và thú vị.,tại sao tôi lại hẹn hò với một người mà tôi thậm chí còn không biết?
nếu tôi không thích cô ấy thì sao?,để thử một cái gì đó mới và thú vị.
thì bạn đừng hẹn hò với cô ấy nữa.,nếu tôi không thích cô ấy thì sao?
Thực ra? với ai?,tôi có một cuộc hẹn vào tối mai.
một cô gái tôi gặp ở chợ.,Thực ra? với ai?
bạn gặp một cô gái ở siêu thị?,một cô gái tôi gặp ở chợ.
cô ấy đang đứng sau tôi trong một hàng rất chậm ở quầy tính tiền.,bạn gặp một cô gái ở siêu thị?
bạn đã nói gì với cô ấy?,cô ấy đang đứng sau tôi trong một hàng rất chậm ở quầy tính tiền.
một người đàn ông tôi gặp ở quán cà phê.,bạn đã đi chơi với ai?
bạn đã đi đâu?,một người đàn ông tôi gặp ở quán cà phê.
chúng tôi đã đến một nhà hàng đẹp,bạn đã đi đâu?
bất cứ nơi nào khác?,chúng tôi đã đến một nhà hàng đẹp
sau đó chúng tôi đến một câu lạc bộ nhạc jazz.,bất cứ nơi nào khác?
nghe có vẻ là một cuộc hẹn hò tốt đẹp.,sau đó chúng tôi đến một câu lạc bộ nhạc jazz.
chuyện gì đã xảy ra thế?,đêm nọ tôi đã có cuộc hẹn tồi tệ nhất.
sau đó anh ta không buồn xin lỗi.,đó không phải là một khởi đầu tốt
điều đó thật thô lỗ.,sau đó anh ta không buồn xin lỗi.
sau đó anh ta lái xe quá nhanh đến nhà hàng.,điều đó thật thô lỗ.
Điều đó thật nguy hiểm.,sau đó anh ta lái xe quá nhanh đến nhà hàng.
tôi nghĩ đến việc ra ngoài và bắt taxi về nhà.,Điều đó thật nguy hiểm.
chuyện gì đã xảy ra ở nhà hàng vậy?,tôi nghĩ đến việc ra ngoài và bắt taxi về nhà.
tại sao không?,tôi không thích người đàn ông đó
ông ấy là một ông già bẩn thỉu.,tại sao không?
Ý anh là gì?,ông ấy là một ông già bẩn thỉu.
nhưng rất nhiều người già vẫn thích hẹn hò.,anh ấy nên hành động đúng tuổi của mình.
họ nên tìm một sở thích thú vị.,nhưng rất nhiều người già vẫn thích hẹn hò.
chỉ cần đợi cho đến khi bạn 50 tuổi.,họ nên tìm một sở thích thú vị.
hẹn hò sẽ là điều xa vời nhất trong tâm trí tôi.,chỉ cần đợi cho đến khi bạn 50 tuổi.
đó là những gì bạn nói bây giờ đợi đến khi bạn 50 tuổi.,hẹn hò sẽ là điều xa vời nhất trong tâm trí tôi.
Thỉnh thoảng.,bạn gái của bạn có bao giờ làm bạn tức giận không?
cô ấy làm gì?,Thỉnh thoảng.
đó là những gì tôi nghĩ,đó là một điều tốt đẹp để nói.
cô ấy đã nói gì thế?,đó là những gì tôi nghĩ
cô ấy đã cười! cô ấy không tin tôi.,cô ấy đã nói gì thế?
điều đó không tốt chút nào với cô ấy.,cô ấy đã cười! cô ấy không tin tôi.
cô ấy nói rằng đối với tôi không có gì quan trọng hơn tiền.,điều đó không tốt chút nào với cô ấy.
bạn đã nói gì thế?,cô ấy nói rằng đối với tôi không có gì quan trọng hơn tiền.
tôi đã nói với cô ấy rằng tôi sẽ không đánh đổi cô ấy để lấy bất kỳ người phụ nữ nào khác trên thế giới.,bạn đã nói gì thế?
tôi ước gì tôi có một cái mũi tốt của tôi quá lớn.,một số người có mũi tốt.
ý tôi không phải là đẹp trai. ý tôi là có mùi thơm.,tôi ước gì tôi có một cái mũi tốt của tôi quá lớn.
Ồ. nhưng đó có thể là một lời nguyền.,ý tôi không phải là đẹp trai. ý tôi là có mùi thơm.
cô ấy có bắt gặp bạn sử dụng ma túy không?,tôi sẽ nói. bạn gái tôi có cái mũi giống con chó nghiện ma túy.
đại loại thế. cô ấy biết bất cứ khi nào tôi lén hút thuốc.,cô ấy có bắt gặp bạn sử dụng ma túy không?
bạn không cần phải có cái mũi thính lắm - thuốc lá có mùi hôi.,đại loại thế. cô ấy biết bất cứ khi nào tôi lén hút thuốc.
điều đó nghe có vẻ vui.,chúng ta hãy ra ngoài ăn nhé.
bạn muốn đi đâu?,điều đó nghe có vẻ vui.
hãy để tôi suy nghĩ một phút.,bạn muốn đi đâu?
tôi cảm thấy như người Trung Quốc,hãy để tôi suy nghĩ một phút.
nghe có vẻ ngon đấy.,tôi cảm thấy như người Trung Quốc
tôi biết một nhà hàng Trung Quốc ngon.,nghe có vẻ ngon đấy.
nó cách đây bao xa?,tôi biết một nhà hàng Trung Quốc ngon.
nó chỉ cách đây 10 phút.,nó cách đây bao xa?
chúng tôi có cần đặt chỗ trước không?,nó chỉ cách đây 10 phút.
đó là bởi vì họ nấu nó trong khi bạn chờ đợi.,đó là chiếc bánh hamburger chậm nhất trong thị trấn.
Đúng. đó là lý do tại sao nó cũng là chiếc bánh hamburger ngon nhất trong thị trấn.,đó là bởi vì họ nấu nó trong khi bạn chờ đợi.
một chiếc burger tuyệt vời và dịch vụ tuyệt vời.,Đúng. đó là lý do tại sao nó cũng là chiếc bánh hamburger ngon nhất trong thị trấn.
tôi đã đến đây nhiều năm rồi.,và chúng sạch sẽ.
Tôi cũng vậy.,tôi đã đến đây nhiều năm rồi.
xin lỗi. họ vừa gọi vào số của tôi.,Tôi cũng vậy.
Cảm ơn.,bữa trưa rất ngon.
đó là loại súp gì vậy?,Cảm ơn.
đó là súp cà chua.,đó là loại súp gì vậy?
mùi vị rất ngon.,đó là súp cà chua.
tôi cho chanh và bơ vào đó.,mùi vị rất ngon.
đặc biệt là trên bánh mì nướng.,mọi người đều thích bánh mì kẹp thịt xông khói và cà chua.
tôi không thể đợi được,ngày mai chúng ta sẽ có cơm và cá cho bữa trưa.
có chuyện gì thế?,tôi đang gọi người phục vụ.
món bít tết này có quá nhiều chất béo.,có chuyện gì thế?
bạn muốn người phục vụ làm gì?,món bít tết này có quá nhiều chất béo.
mang cho tôi món bít-tết ngon hơn.,bạn muốn người phục vụ làm gì?
tôi sẽ không làm điều đó,mang cho tôi món bít-tết ngon hơn.
tại sao không?,tôi sẽ không làm điều đó
sau đó người phục vụ sẽ cười thật tươi khi mang cho bạn món bít tết mới.,bạn điên rồi.
bạn lấy những ý tưởng điên rồ này ở đâu?,sau đó người phục vụ sẽ cười thật tươi khi mang cho bạn món bít tết mới.
tôi đã từng nấu ăn ở một nhà hàng!,bạn lấy những ý tưởng điên rồ này ở đâu?
nhưng chúng tôi vừa mới đến đây.,chúng ta hãy rời đi.
bạn có nhìn thấy bàn tay của người phục vụ không?,nhưng chúng tôi vừa mới đến đây.
KHÔNG.,bạn có nhìn thấy bàn tay của người phục vụ không?
anh ấy có móng tay bẩn.,KHÔNG.
Thực ra?,anh ấy có móng tay bẩn.
móng tay của anh ấy màu đen!,Thực ra?
điều đó thật kinh tởm.,móng tay của anh ấy màu đen!
và anh ấy rót nước vào ly của chúng tôi.,điều đó thật kinh tởm.
ôi! không có nước cho tôi.,và anh ấy rót nước vào ly của chúng tôi.
tôi thích nhà hàng này vì họ cho bạn bánh mì miễn phí.,bánh mì nóng này ngon lắm.
có lẽ họ sẽ không thích điều đó.,tôi nghĩ chúng ta nên rời đi sau khi ăn no bánh mì.
Tôi đang ăn nhiều bánh mì đến nỗi tôi thấy no rồi.,có lẽ họ sẽ không thích điều đó.
thì đừng ăn bánh mì nữa!,Tôi đang ăn nhiều bánh mì đến nỗi tôi thấy no rồi.
nó vượt qua sự kiểm tra.,kiểm tra đồ dùng bằng bạc.
người phục vụ tới đây. xem tay và móng tay của anh ấy có sạch không.,nó vượt qua sự kiểm tra.
tôi chỉ hy vọng phòng tắm sạch sẽ.,bạn quên mất phòng tắm rồi.
bạn sẽ không kiểm tra nó trước khi chúng ta gọi bữa tối à?,tôi chỉ hy vọng phòng tắm sạch sẽ.
bây giờ anh ấy đến đây.,bạn có thấy người phục vụ của chúng tôi không?
chúng ta đã ngồi đây được gần 10 phút rồi.,bây giờ anh ấy đến đây.
đó là một ý tưởng tốt,Tôi sẽ lên trước và nói chuyện với người quản lý.
có lẽ họ sẽ cho chúng ta đồ uống miễn phí vì phải chờ đợi quá lâu.,đó là một ý tưởng tốt
có lẽ anh ấy sẽ gửi người phục vụ cho chúng tôi ngay lập tức.,có lẽ họ sẽ cho chúng ta đồ uống miễn phí vì phải chờ đợi quá lâu.
cái đó. một nhóm tám người chỉ ngồi xuống đó.,Tuyệt. cái nào?
lần này là gì thế?,tôi không tin vào thế giới nghệ thuật.
một bức vẽ của Andy Warhol.,lần này là gì thế?
anh ấy là một nghệ sĩ nổi tiếng,một bức vẽ của Andy Warhol.
anh ấy vẽ hai con bướm và một bông hoa trên khăn ăn trong một nhà hàng.,anh ấy là một nghệ sĩ nổi tiếng
anh ấy đã ký nó phải không?,anh ấy vẽ hai con bướm và một bông hoa trên khăn ăn trong một nhà hàng.
Đúng.,anh ấy đã ký nó phải không?
nó có đẹp không?,Đúng.
nó chỉ là mực đen trên khăn ăn màu trắng. và khăn ăn có vết thức ăn!,nó có đẹp không?
vậy là nó không có giá trị bao nhiêu?,nó chỉ là mực đen trên khăn ăn màu trắng. và khăn ăn có vết thức ăn!
tất nhiên rồi.,chúng ta có thể đi xem trận bóng chày được không?
tôi yêu bóng chày.,tất nhiên rồi.
tôi cũng vậy.,tôi yêu bóng chày.
tôi thích ăn đậu phộng,tôi cũng vậy.
tôi thích ăn xúc xích,tôi thích ăn đậu phộng
tôi hy vọng chúng ta sẽ thấy một trận chạy về nhà.,tôi thích ăn xúc xích
tôi hy vọng chúng ta sẽ bắt được một quả bóng phạm lỗi.,tôi hy vọng chúng ta sẽ thấy một trận chạy về nhà.
mang theo một chiếc áo khoác.,tôi hy vọng chúng ta sẽ bắt được một quả bóng phạm lỗi.
Đúng. trời trở nên mát mẻ một chút vào ban đêm.,mang theo một chiếc áo khoác.
mang theo găng tay để bắt bóng phạm lỗi.,Đúng. trời trở nên mát mẻ một chút vào ban đêm.
KHÔNG. tôi sẽ chỉ dùng mũ của mình để bắt một quả bóng phạm lỗi.,mang theo găng tay để bắt bóng phạm lỗi.
chắc chắn là vậy.,golf là một trò chơi ngớ ngẩn.
bạn đánh một quả bóng màu trắng.,chắc chắn là vậy.
và sau đó bạn đuổi theo nó.,bạn đánh một quả bóng màu trắng.
và sau đó bạn đánh nó một lần nữa.,và sau đó bạn đuổi theo nó.
làm sao có thể vui được?,vấn đề là gì?
họ trả tiền để chơi trò chơi ngớ ngẩn này!,làm sao có thể vui được?
tôi nghĩ người chơi golf có vấn đề về tâm thần.,họ trả tiền để chơi trò chơi ngớ ngẩn này!
tôi nghĩ họ điên rồi.,tôi nghĩ người chơi golf có vấn đề về tâm thần.
Đúng. đó là một ý tưởng tốt,bạn có muốn đi câu cá không?
bạn muốn đi đâu?,Đúng. đó là một ý tưởng tốt
chúng ta có thể đi ra sông,bạn muốn đi đâu?
hoặc chúng ta có thể đi đến hồ.,chúng ta có thể đi ra sông
hoặc chúng ta có thể đi ra biển.,hoặc chúng ta có thể đi đến hồ.
chúng ta hãy đi đến hồ.,hoặc chúng ta có thể đi ra biển.
Đúng. hồ chỉ là 10 dặm.,chúng ta hãy đi đến hồ.
chúng ta có thể đến đó trong 20 phút.,Đúng. hồ chỉ là 10 dặm.
tôi sẽ lấy cần câu của chúng ta.,chúng ta có thể đến đó trong 20 phút.
tôi sẽ lấy mồi.,tôi sẽ lấy cần câu của chúng ta.
chúng ta sẽ có cá tươi cho bữa tối!,tôi sẽ lấy mồi.
tôi thích đánh bóng,bóng chày rất vui.
tôi thích chạy quanh các căn cứ.,tôi thích đánh bóng
tôi thích trượt vào căn cứ.,tôi thích chạy quanh các căn cứ.
vâng. trượt rất thú vị.,tôi thích trượt vào căn cứ.
tôi muốn trở thành một cầu thủ bóng chày khi lớn lên.,vâng. trượt rất thú vị.
Tôi cũng vậy. tôi muốn chơi cho đội Yankees.,tôi muốn trở thành một cầu thủ bóng chày khi lớn lên.
không phải tôi. tôi muốn chơi cho đội né tránh.,Tôi cũng vậy. tôi muốn chơi cho đội Yankees.
chúng ta phải luyện tập hàng ngày.,không phải tôi. tôi muốn chơi cho đội né tránh.
tôi không thích luyện tập,chúng ta phải luyện tập hàng ngày.
tôi cũng vậy. nó thật nhàm chán.,tôi không thích luyện tập
nhưng luyện tập sẽ tạo nên sự hoàn hảo.,tôi cũng vậy. nó thật nhàm chán.
đó là một ý tưởng tốt,chúng ta hãy đi chạy bộ.
tôi đã mua vài đôi giày mới,đó là một ý tưởng tốt
họ có thoải mái không?,tôi đã mua vài đôi giày mới
họ rất thoải mái.,họ có thoải mái không?
chúng bao nhiêu?,họ rất thoải mái.
chúng được bán với giá 80 đô la.,chúng bao nhiêu?
chúng có giúp bạn chạy nhanh hơn không?,chúng được bán với giá 80 đô la.
bạn có thể muốn mua một cặp.,thì chúng đáng giá từng xu.
tôi sẽ đợi cho đến khi tôi mặc đôi này ra.,bạn có thể muốn mua một cặp.
bạn có thể nói lại điều đó,hổ là tay golf giỏi nhất thế giới
nhưng tôi lo lắng về con hổ.,bạn có thể nói lại điều đó
tại sao vậy?,nhưng tôi lo lắng về con hổ.
vì anh ấy thích lặn biển.,tại sao vậy?
có chuyện gì vậy?,vì anh ấy thích lặn biển.
nó có thể nguy hiểm.,có chuyện gì vậy?
ý bạn là anh ấy có thể chết đuối.,nó có thể nguy hiểm.
anh ấy không nên lặn biển cho đến khi nghỉ hưu.,ý bạn là anh ấy có thể chết đuối.
nhưng anh ấy lặn để thư giãn.,anh ấy không nên lặn biển cho đến khi nghỉ hưu.
cái mà con hổ đã thắng?,bạn có xem giải đấu golf đó không?
anh ấy đã làm điều đó như thế nào?,cái mà con hổ đã thắng?
nó chẳng là gì đối với anh ấy.,anh ấy đã làm điều đó như thế nào?
anh ấy thực hiện cú putt dài 20 foot ở lỗ cuối cùng để giành chiến thắng chỉ bằng một cú đánh!,nó chẳng là gì đối với anh ấy.
anh ấy đã đánh chìm một vận động viên cao 25 ​​foot vào năm ngoái tại cùng một giải đấu để giành chiến thắng chỉ bằng một gậy.,anh ấy thực hiện cú putt dài 20 foot ở lỗ cuối cùng để giành chiến thắng chỉ bằng một cú đánh!
tôi nghĩ anh ấy đến từ ngoài vũ trụ,anh ấy đã đánh chìm một vận động viên cao 25 ​​foot vào năm ngoái tại cùng một giải đấu để giành chiến thắng chỉ bằng một gậy.
không con người nào có thể chơi gôn giỏi đến thế.,tôi nghĩ anh ấy đến từ ngoài vũ trụ
ai đó nên kiểm tra hồ sơ khai sinh của anh ấy.,không con người nào có thể làm được điều đó.
tôi cá là nó nói anh ấy sinh ra trên sao Hỏa.,ai đó nên kiểm tra hồ sơ khai sinh của anh ấy.
có rất nhiều cầu thủ tuyệt vời.,ai là cầu thủ bóng chày vĩ đại nhất?
hầu hết mọi người sẽ nói vậy.,anh phải nói là em yêu ruth.
anh ấy đã thay đổi trò chơi.,hầu hết mọi người sẽ nói vậy.
sẽ không bao giờ có một em bé nào nữa.,anh ấy luôn đến thăm bệnh viện để động viên những đứa trẻ bị bệnh.
điều đó không hay chút nào.,ai đó đã đấm ai đó.
nó còn tệ hơn thế.,điều đó không hay chút nào.
sao vậy?,nó còn tệ hơn thế.
hai người đã cãi nhau.,sao vậy?
tôi cá là họ đang uống rượu.,hai người đã cãi nhau.
gã thứ ba đấm một trong hai gã.,tôi cá là họ đang uống rượu.
điều đó thật khủng khiếp. mọi người không thể vui vẻ trong một trận bóng chày sao?,nạn nhân đập đầu vào bậc thềm bê tông tử vong.
tối nay có trò chơi không?,tôi muốn đi xem trận bóng.
chúng chỉ có 5 đô la mỗi cái.,chúng giá bao nhiêu?
đó là một mức giá tốt,chúng chỉ có 5 đô la mỗi cái.
họ ở phía sau sân ngoài.,chỗ ngồi ở đâu?
có lẽ chúng ta có thể bắt được một quả bóng chạy về nhà.,họ ở phía sau sân ngoài.
có gì khó khi đánh một quả bóng nhỏ màu trắng?,chơi gôn khó quá.
thật khó nếu bạn muốn làm đúng.,có gì khó khi đánh một quả bóng nhỏ màu trắng?
ý bạn là giống hổ?,thật khó nếu bạn muốn làm đúng.
có rất nhiều điều bạn phải làm đúng.,chơi gôn có gì khó?
như thế nào?,có rất nhiều điều bạn phải làm đúng.
bạn cần phải nhận được rất nhiều bài học khi bạn còn trẻ.,ôi! ai có thể nhớ tất cả những điều đó?
quên nó đi. chơi gôn nghe giống công việc hơn là niềm vui.,bạn cần phải nhận được rất nhiều bài học khi bạn còn trẻ.
kẻ nghiện ma túy chạy về nhà?,bạn đã nghe nói về người chơi bóng chưa?
anh ấy nói rằng một bác sĩ đã giúp anh ấy giải quyết một vấn đề cá nhân.,kẻ nghiện ma túy chạy về nhà?
anh ấy nói anh ấy không sử dụng ma túy.,anh ấy nói rằng một bác sĩ đã giúp anh ấy giải quyết một vấn đề cá nhân.
anh ấy đã xin lỗi người hâm mộ.,anh ấy nói anh ấy không sử dụng ma túy.
liên đoàn đã đình chỉ anh ta trong 50 trận.,anh ấy đã xin lỗi người hâm mộ.
điều đó sẽ khiến anh ta tốn một số tiền.,liên đoàn đã đình chỉ anh ta trong 50 trận.
có lẽ anh ấy sẽ không sử dụng ma túy nữa.,điều đó sẽ dạy cho anh ta một bài học tốt.
nhưng nó sẽ không ngăn được những người chơi khác sử dụng ma túy.,có lẽ anh ấy sẽ không sử dụng ma túy nữa.
KHÔNG. mọi người luôn cho rằng họ sẽ không bị bắt.,nhưng nó sẽ không ngăn được những người chơi khác sử dụng ma túy.
bởi vì cha mẹ không dạy con mình đúng sai.,tại sao có quá nhiều tội phạm?
đó là nó phải không?,bởi vì cha mẹ không dạy con mình đúng sai.
chỉ có một cảnh sát trên 100 tội phạm.,nhưng có rất nhiều cảnh sát.
chúng ta không thể thuê thêm cảnh sát à?,chỉ có một cảnh sát trên 100 tội phạm.
KHÔNG. nó tốn quá nhiều tiền.,chúng ta không thể thuê thêm cảnh sát à?
tội phạm không tốn kém hơn cảnh sát sao?,KHÔNG. nó tốn quá nhiều tiền.
không có tội phạm ở đây.,tôi cảm thấy an toàn ở đây
tôi ước tôi có thể chuyển đến đây,không có tội phạm ở đây.
chuyện gì đã xảy ra thế?,ngôi nhà bị thiêu rụi.
người đàn ông đã ngủ quên.,chuyện gì đã xảy ra thế?
anh ấy có hút thuốc không?,người đàn ông đã ngủ quên.
pin đã chết.,điều đó quá tệ. còn chuông báo khói của anh ấy thì sao?
một cục pin tốt sẽ cứu mạng anh ấy.,pin đã chết.
anh ta đã ở tù ba lần rồi.,họ nói rằng anh ta đã gây ra mười lăm vụ cháy lớn.
tại sao họ lại thả anh ta ra ngoài?,anh ta đã ở tù ba lần rồi.
đó là luật pháp họ không thể giữ anh ta trong tù mãi mãi.,tại sao họ lại thả anh ta ra ngoài?
tại sao không? mọi người đều biết anh ấy là một con bọ lửa. anh ấy thích đốt lửa.,đó là luật pháp họ không thể giữ anh ta trong tù mãi mãi.
Tôi không biết. đôi khi luật pháp không có ý nghĩa.,tại sao không? mọi người đều biết anh ấy là một con bọ lửa. anh ấy thích đốt lửa.
nhưng vụ cháy mới nhất của anh ta đã giết chết một người.,Tôi không biết. đôi khi luật pháp không có ý nghĩa.
lần này họ đã buộc tội anh ta tội giết người.,nhưng vụ cháy mới nhất của anh ta đã giết chết một người.
vậy có lẽ anh ta sẽ phải vào tù mãi mãi?,lần này họ đã buộc tội anh ta tội giết người.
tôi chắc chắn hy vọng như vậy.,vậy có lẽ anh ta sẽ phải vào tù mãi mãi?
ai đó nên đốt anh ta.,tôi chắc chắn hy vọng như vậy.
điều đó sẽ dạy cho anh ta một bài học tốt.,ai đó nên đốt anh ta.
Tại sao?,thắt dây an toàn vào.
vì nó sẽ bảo vệ bạn trong trường hợp xảy ra tai nạn.,Tại sao?
nhưng nó không thoải mái.,vì nó sẽ bảo vệ bạn trong trường hợp xảy ra tai nạn.
đó là luật pháp,nhưng nó không thoải mái.
rắc rối quá.,đó là luật pháp
đó là lẽ thường.,rắc rối quá.
nó chật đến nỗi tôi khó thở.,đó là lẽ thường.
nín thở cho đến khi chúng ta tới đó.,nó chật đến nỗi tôi khó thở.
tôi đã sẵn sàng cho một tai nạn,tôi mừng vì bạn không phàn nàn nhiều.
tôi định thay bóng đèn. nó cháy hết.,Bạn đang làm gì thế?
bạn đang đứng trên cái gì thế?,tôi định thay bóng đèn. nó cháy hết.
một vài từ điển và một số sách giáo khoa.,bạn đang đứng trên cái gì thế?
bạn có điên không?,một vài từ điển và một số sách giáo khoa.
có chuyện gì thế?,bạn có điên không?
những cuốn sách đó sẽ trượt và bạn sẽ ngã.,có chuyện gì thế?
nó chỉ có một vài feet.,những cuốn sách đó sẽ trượt và bạn sẽ ngã.
bạn sẽ bị mù suốt đời!,tôi chưa bao giờ nghĩ về điều đó
tôi sẽ lấy cái thang.,bạn sẽ bị mù suốt đời!
Đúng. tôi đã yêu cầu dọn dẹp.,bạn có thấy vũng nước trên sàn không?
một vũng nước rất nguy hiểm.,Đúng. tôi đã yêu cầu dọn dẹp.
nó không phải là dễ dàng để nhìn thấy.,một vũng nước rất nguy hiểm.
nhưng nó rất dễ trượt.,nó không phải là dễ dàng để nhìn thấy.
đặc biệt là trên những sàn trơn bóng này.,nhưng nó rất dễ trượt.
ai đó trượt chân có thể bị đau lưng.,đặc biệt là trên những sàn trơn bóng này.
họ thậm chí có thể đập vỡ đầu mình.,ai đó trượt chân có thể bị đau lưng.
chúng ta nên đứng đây cho đến khi người dọn dẹp tới.,họ thậm chí có thể đập vỡ đầu mình.
chúng ta có thể rời đi nếu chúng ta đặt một hình nón màu cam ở đây.,chúng ta nên đứng đây cho đến khi người dọn dẹp tới.
chúng tôi bảo học sinh rời khỏi lớp học.,điều gì xảy ra khi chuông báo cháy reo?
họ có thể lấy đồ đạc của họ không?,chúng tôi bảo học sinh rời khỏi lớp học.
họ đi ra bãi đậu xe phía bắc.,học sinh đi đâu?
giáo viên làm gì?,họ đi ra bãi đậu xe phía bắc.
chúng tôi đưa người phân công của mình đến bãi đậu xe và lăn bánh.,giáo viên làm gì?
tại sao bạn làm điều đó?,chúng tôi đưa người phân công của mình đến bãi đậu xe và lăn bánh.
chúng tôi muốn đảm bảo tất cả học sinh đều ra khỏi tòa nhà.,tại sao bạn làm điều đó?
Tại sao? chúng ta đã muộn rồi.,tôi phải quay lại tầng trên.
tôi phải kiểm tra bếp lò.,Tại sao? chúng ta đã muộn rồi.
có chuyện gì thế?,tôi phải kiểm tra bếp lò.
có lẽ tôi đã để lửa bật.,có chuyện gì thế?
tất nhiên là tôi chắc chắn.,bạn có chắc không?
tôi nghĩ tôi đã để nước chảy.,nó đang muộn hơn mỗi phút.
họ đang trả những gì?,thành phố đang mua súng.
họ muốn loại bỏ súng khỏi đường phố.,tại sao họ làm điều này?
ai sẽ giao súng với giá 200 đô la?,họ muốn loại bỏ súng khỏi đường phố.
đó không phải là một việc tốt?,ai sẽ giao súng với giá 200 đô la?
một khẩu súng tốt có giá từ 400 USD trở lên.,đó không phải là một việc tốt?
tôi không biết bạn có súng.,tôi sẽ giữ biên lai và súng của tôi.
mọi người ở Mỹ nên có súng.,tôi không biết bạn có súng.
tôi chắc chắn là vậy.,bạn đang ngáp.
bạn nên đi ngủ.,tôi chắc chắn là vậy.
tôi sẽ làm ngay khi tôi hoàn thành bài viết này.,bạn nên đi ngủ.
bạn đang đọc gì thế?,tôi sẽ làm ngay khi tôi hoàn thành bài viết này.
đó là về tội phạm ở Los Angeles.,bạn đang đọc gì thế?
nó nói gì vậy?,đó là về tội phạm ở Los Angeles.
thị trưởng nói rằng tỷ lệ tội phạm đang giảm.,nó nói gì vậy?
